{
  "$schema": "http://json-schema.org/draft-07/schema#",
  "type": "object",
  "properties": {
    "project_name": { "type": "string" },
    "version": { "type": "string" },
    "dependencies": {
      "type": "array",
      "items": {
        "type": "object",
        "properties": {
          "name": { "type": "string" },
          "package": { "type": "string" },
          "type": { "enum": ["git", "path", "zip"] },
          "git_repo": { "type": "string" },
          "git_tag": { "type": "string" },
          "url": { "type": "string" },
          "path": { "type": "string" },
          "version": { "type": "string" },
          "required_version": { "type": "boolean" },
          "installation": { "enum": ["local", "global"] },
          "update_strategy": { "enum": ["always", "if_not_exists", "never"] },
          "custom_commands": {
            "type": "array",
            "items": { "type": "string" }
          },
          "retention": { 
            "type": "string",
            "pattern": "^(\\d+[dwm]|forever)$"
          },
          "custom_handler": { "type": "string" }
        },
        "required": ["name", "type"],
        "if": {
          "properties": { "type": { "const": "git" } }
        },
        "then": {
          "required": ["git_repo"]
        },
        "else": {
          "if": {
            "properties": { "type": { "const": "path" } }
          },
          "then": {
            "required": ["path"]
          },
          "else": {
            "required": ["url"]
          }
        }
      }
    },
    "allow_later_versions": { "type": "boolean" },
    "recursive_dependencies": { "type": "boolean" },
    "dependency_cache": { "type": "string" }
  },
  "required": ["project_name", "dependencies"]
}
